{
  "evidence_id": "550e8400-e29b-41d4-a716-446655440050",
  "source_type": "internal",
  "source_identity": {
    "knowledge_base_id": "550e8400-e29b-41d4-a716-446655440010",
    "document_id": "550e8400-e29b-41d4-a716-446655440020",
    "document_version_id": "550e8400-e29b-41d4-a716-446655440031",
    "segment_id": "550e8400-e29b-41d4-a716-446655440041"
  },
  "display": { "title": "权限设计文档", "location_summary": "第 3 页" },
  "captured_at": "2026-08-04T12:05:00Z",
  "source_observed_at": "2026-08-03T09:00:00Z",
  "score_summary": { "best_score": 0.87, "score_kind": "vector", "rank": 0 },
  "validity": "available"
}
